source_id,category,status,description,license,url,access_notes,harvest_command
gdpr_eur_2016_679,data_collection_use,planned,"Official EUR-Lex text of GDPR","EU law (public domain)","https://eur-lex.europa.eu/eli/reg/2016/679/oj","Download via EUR-Lex API; store PDF + HTML versions","npm run ml:harvest -- --source gdpr"
ccpa_california,data_collection_use,planned,"California Consumer Privacy Act statutory text","California state law (public domain)","https://leginfo.legislature.ca.gov/faces/codes_displayText.xhtml?division=3.&chapter=1.&part=4.&lawCode=CIV&title=1.81.5","Use California Legislative Information API; capture revision date","npm run ml:harvest -- --source ccpa"
ftc_privacy_settlements,user_privacy,planned,"FTC privacy enforcement complaints and consent orders","US Federal government works (public domain)","https://www.ftc.gov/legal-library/browse/cases-proceedings","Scrape docket metadata; track consent order PDFs","npm run ml:harvest -- --source ftc_privacy"
edpb_guidelines,user_privacy,planned,"European Data Protection Board GDPR guidance documents","Public domain","https://edpb.europa.eu/our-work-tools/general-guidance_en","Download PDFs; convert to text via scripts/conversion/pdf_to_text.py","npm run ml:harvest -- --source edpb_guidelines"
policyqa_corpus,data_collection_use|user_privacy,pending_access,"PolicyQA dataset with QA pairs from privacy policies","CC BY-SA 4.0","https://huggingface.co/datasets/ought/raft","Verify attribution requirements before redistribution","python scripts/harvest_policyqa.py --output data/raw/policyqa"
sec_privacy_8k,user_privacy,planned,"SEC 8-K filings referencing privacy or data breaches","US SEC filings (public domain)","https://www.sec.gov/edgar/search/","Use EDGAR API; respect rate limits","python scripts/harvest_sec.py --query privacy --output data/raw/sec_privacy"
lex_glue_ledgar,content_rights,in_repo,"LEX-GLUE LEDGAR contract clauses benchmark","MIT License","https://huggingface.co/datasets/lex_glue","Already downloaded under data/raw/MAdAiLab__lex_glue_ledgar","N/A"
cuad_legal_clauses,content_rights,in_repo,"Contract Understanding Atticus Dataset","MIT License","https://huggingface.co/datasets/dvgodoy/CUAD","Already downloaded under data/raw/dvgodoy__CUAD_v1_Contract_Understanding_clause_classification","N/A"
